{
 "schema_version": "task-ir/1.0",
 "task_id": "mw-002",
 "source_task_id": null,
 "world_id": "miniworld",
 "instruction": "Look up the date of THE DUNDIES on my calendar and send Jim Halpert a direct message on HooliWork saying \"Dundies is on <date>, save the date.\"",
 "reference_time": "2026-04-06T09:00:00",
 "nodes": [
  {
   "node_id": "n1",
   "op": "resolve",
   "app": "hoolicalendar",
   "semantic_goal": "Find the THE DUNDIES event",
   "route_hint": [
    "/calendar/search?q=dundies"
   ],
   "reads": [
    {
     "table": "hoolicalendar.events",
     "column": "title",
     "entity_ref": "derived:n1:event_id"
    },
    {
     "table": "hoolicalendar.events",
     "column": "start_at",
     "entity_ref": "derived:n1:event_id"
    },
    {
     "table": "hoolicalendar.events",
     "column": "user_email",
     "entity_ref": "derived:n1:event_id"
    },
    {
     "table": "hoolicalendar.events",
     "column": "status",
     "entity_ref": "derived:n1:event_id"
    }
   ],
   "produces": [
    {
     "name": "event_id",
     "type": "EventRef",
     "derivation": {
      "kind": "sql",
      "query": "SELECT id FROM events WHERE user_email = :owner_email AND title = :title AND status != 'cancelled' ORDER BY start_at LIMIT 1",
      "returns": "scalar"
     }
    }
   ],
   "writes": [],
   "reversibility_class": "R0",
   "side_effects": [],
   "inputs": [
    {
     "port_id": "owner_email",
     "type": "Email",
     "grounding": "person:michael_scott",
     "source": "literal",
     "cardinality": "one",
     "literal": "michael.scott@dundermifflin.com"
    },
    {
     "port_id": "title",
     "type": "Text",
     "grounding": "literal",
     "source": "literal",
     "cardinality": "one",
     "literal": "THE DUNDIES"
    }
   ],
   "outputs": [
    {
     "port_id": "event_id",
     "type": "EventRef",
     "grounding": "derived:n1:event_id",
     "source": "upstream",
     "cardinality": "one"
    }
   ],
   "verifier": {
    "verifier_id": "v-n1",
    "kind": "derived",
    "predicate": "event_id == expected",
    "observability": "derived_from_observable",
    "expected": 545
   },
   "critical": false
  },
  {
   "node_id": "n2",
   "op": "retrieve",
   "app": "hoolicalendar",
   "semantic_goal": "Read the event date",
   "route_hint": [
    "/event/:id"
   ],
   "reads": [
    {
     "table": "hoolicalendar.events",
     "column": "start_at",
     "entity_ref": "derived:n1:event_id",
     "equivalent_sources": [
      {
       "table": "workbuzz.messages",
       "column": "content",
       "entity_ref": "messages:9001"
      }
     ]
    }
   ],
   "produces": [
    {
     "name": "start_at",
     "type": "DateTime",
     "derivation": {
      "kind": "sql",
      "query": "SELECT start_at FROM events WHERE id = :event_id",
      "returns": "scalar"
     }
    }
   ],
   "writes": [],
   "reversibility_class": "R0",
   "side_effects": [],
   "inputs": [
    {
     "port_id": "event_id",
     "type": "EventRef",
     "grounding": "derived:n1:event_id",
     "source": "upstream",
     "cardinality": "one"
    }
   ],
   "outputs": [
    {
     "port_id": "start_at",
     "type": "DateTime",
     "grounding": "derived:n2:start_at",
     "source": "upstream",
     "cardinality": "one"
    }
   ],
   "verifier": null,
   "critical": false
  },
  {
   "node_id": "n3",
   "op": "decide",
   "app": "workbuzz",
   "semantic_goal": "Compose the message text",
   "route_hint": [],
   "reads": [],
   "produces": [
    {
     "name": "dundies_date",
     "type": "Date",
     "derivation": {
      "kind": "expr",
      "expr": "date_of(start_at)"
     }
    },
    {
     "name": "message",
     "type": "Text",
     "derivation": {
      "kind": "expr",
      "expr": "fmt(\"Dundies is on {}, save the date.\", dundies_date)"
     }
    }
   ],
   "writes": [],
   "reversibility_class": "R0",
   "side_effects": [],
   "inputs": [
    {
     "port_id": "start_at",
     "type": "DateTime",
     "grounding": "derived:n2:start_at",
     "source": "upstream",
     "cardinality": "one"
    }
   ],
   "outputs": [
    {
     "port_id": "dundies_date",
     "type": "Date",
     "grounding": "derived:n3:dundies_date",
     "source": "upstream",
     "cardinality": "one"
    },
    {
     "port_id": "message",
     "type": "Text",
     "grounding": "derived:n3:message",
     "source": "upstream",
     "cardinality": "one"
    }
   ],
   "verifier": null,
   "critical": false
  },
  {
   "node_id": "n4",
   "op": "resolve",
   "app": "workbuzz",
   "semantic_goal": "Find the direct-message conversation with Jim",
   "route_hint": [
    "/dm/:id"
   ],
   "reads": [
    {
     "table": "workbuzz.dms",
     "column": "participant_names",
     "entity_ref": "derived:n4:dm_id"
    },
    {
     "table": "workbuzz.dms",
     "column": "is_group",
     "entity_ref": "derived:n4:dm_id"
    }
   ],
   "produces": [
    {
     "name": "dm_id",
     "type": "DmRef",
     "derivation": {
      "kind": "sql",
      "query": "SELECT id FROM dms WHERE is_group = 0 AND participant_names LIKE '%' || :jim_name || '%' ORDER BY id LIMIT 1",
      "returns": "scalar"
     }
    }
   ],
   "writes": [],
   "reversibility_class": "R0",
   "side_effects": [],
   "inputs": [
    {
     "port_id": "jim_name",
     "type": "Text",
     "grounding": "literal",
     "source": "literal",
     "cardinality": "one",
     "literal": "Jim Halpert"
    }
   ],
   "outputs": [
    {
     "port_id": "dm_id",
     "type": "DmRef",
     "grounding": "derived:n4:dm_id",
     "source": "upstream",
     "cardinality": "one"
    }
   ],
   "verifier": {
    "verifier_id": "v-n4",
    "kind": "derived",
    "predicate": "dm_id == expected",
    "observability": "derived_from_observable",
    "expected": 1
   },
   "critical": false
  },
  {
   "node_id": "n5",
   "op": "communicate",
   "app": "workbuzz",
   "semantic_goal": "Send the message",
   "route_hint": [
    "/dm/:id"
   ],
   "reads": [],
   "produces": [
    {
     "name": "message_id",
     "type": "MessageRef",
     "derivation": {
      "kind": "create",
      "table": "workbuzz.dm_messages"
     }
    }
   ],
   "writes": [
    {
     "table": "workbuzz.dm_messages",
     "column": "dm_id",
     "entity_ref": "derived:n5:message_id",
     "effect_type": "send_message",
     "value_ref": "dm_id"
    },
    {
     "table": "workbuzz.dm_messages",
     "column": "sender_email",
     "entity_ref": "derived:n5:message_id",
     "effect_type": "send_message",
     "value_ref": "sender_email"
    },
    {
     "table": "workbuzz.dm_messages",
     "column": "sender_name",
     "entity_ref": "derived:n5:message_id",
     "effect_type": "send_message",
     "value": "Michael Scott"
    },
    {
     "table": "workbuzz.dm_messages",
     "column": "content",
     "entity_ref": "derived:n5:message_id",
     "effect_type": "send_message",
     "value_ref": "message"
    },
    {
     "table": "workbuzz.dm_messages",
     "column": "timestamp",
     "entity_ref": "derived:n5:message_id",
     "effect_type": "send_message",
     "value_ref": "reference_time"
    }
   ],
   "reversibility_class": "R3",
   "side_effects": [
    {
     "effect_id": "fx-n5",
     "effect_type": "send_message",
     "target_ref": "derived:n4:dm_id",
     "reversibility_class": "R3",
     "commit_scope": "shared_environment",
     "compensation_available": false,
     "compensating_effect_type": null,
     "compensation_verifier_id": null,
     "checkpoint_required": true,
     "checkpoint_id": null,
     "restore_verifier_id": null
    }
   ],
   "inputs": [
    {
     "port_id": "dm_id",
     "type": "DmRef",
     "grounding": "derived:n4:dm_id",
     "source": "upstream",
     "cardinality": "one"
    },
    {
     "port_id": "message",
     "type": "Text",
     "grounding": "derived:n3:message",
     "source": "upstream",
     "cardinality": "one"
    },
    {
     "port_id": "sender_email",
     "type": "Email",
     "grounding": "person:michael_scott",
     "source": "literal",
     "cardinality": "one",
     "literal": "michael.scott@dundermifflin.com"
    }
   ],
   "outputs": [
    {
     "port_id": "message_id",
     "type": "MessageRef",
     "grounding": "derived:n5:message_id",
     "source": "upstream",
     "cardinality": "one"
    }
   ],
   "verifier": {
    "verifier_id": "v-n5",
    "kind": "sql",
    "predicate": "SELECT content = :message AND dm_id = :dm_id FROM dm_messages WHERE id = :message_id",
    "observability": "environment_state"
   },
   "critical": true
  }
 ],
 "edges": [
  {
   "edge_id": "e1",
   "from": {
    "node_id": "n1",
    "port_id": "event_id"
   },
   "to": {
    "node_id": "n2",
    "port_id": "event_id"
   },
   "kind": "data_dependency"
  },
  {
   "edge_id": "e2",
   "from": {
    "node_id": "n2",
    "port_id": "start_at"
   },
   "to": {
    "node_id": "n3",
    "port_id": "start_at"
   },
   "kind": "data_dependency"
  },
  {
   "edge_id": "e3",
   "from": {
    "node_id": "n3",
    "port_id": "message"
   },
   "to": {
    "node_id": "n5",
    "port_id": "message"
   },
   "kind": "data_dependency"
  },
  {
   "edge_id": "e4",
   "from": {
    "node_id": "n4",
    "port_id": "dm_id"
   },
   "to": {
    "node_id": "n5",
    "port_id": "dm_id"
   },
   "kind": "data_dependency"
  }
 ],
 "final_verifier": {
  "verifier_id": "final-mw-002",
  "kind": "sql",
  "predicate": "SELECT count(*) > 0 FROM dm_messages WHERE dm_id = 1 AND sender_email = 'michael.scott@dundermifflin.com' AND content LIKE '%2026-07-02%'",
  "observability": "environment_state",
  "app": "workbuzz",
  "equivalent_final_states": [
   {
    "predicate": "SELECT count(*) > 0 FROM dm_messages WHERE dm_id = 1 AND sender_email = 'michael.scott@dundermifflin.com' AND content LIKE '%July 2%'"
   }
  ]
 },
 "provenance": {
  "author": "hand-written miniworld fixture",
  "failure_fixture": "traces/mw002_param_failure.json",
  "success_fixture": "traces/mw002_success.json"
 }
}
